{
  "$defs": {
    "rational": {
      "additionalProperties": false,
      "properties": {
        "den": {
          "pattern": "^[1-9][0-9]*$",
          "type": "string"
        },
        "num": {
          "pattern": "^(?:0|-?[1-9][0-9]*)$",
          "type": "string"
        }
      },
      "required": [
        "num",
        "den"
      ],
      "type": "object"
    }
  },
  "$schema": "https://json-schema.org/draft/2020-12/schema",
  "additionalProperties": false,
  "properties": {
    "claimed_assurance": {
      "enum": [
        "UNVERIFIED",
        "COMPUTED",
        "CHECKED",
        "VERIFIED"
      ]
    },
    "completeness": {
      "const": "COMPLETE"
    },
    "conclusion": {
      "const": "INTEGRAL_H1_CERTIFIED"
    },
    "evidence": {
      "items": {
        "additionalProperties": false,
        "properties": {
          "path": {
            "const": "evidence/certificate.json"
          },
          "sha256": {
            "pattern": "^sha256:[0-9a-f]{64}$",
            "type": "string"
          }
        },
        "required": [
          "path",
          "sha256"
        ],
        "type": "object"
      },
      "maxItems": 1,
      "minItems": 1,
      "type": "array"
    },
    "limitations": {
      "maxItems": 1,
      "minItems": 1,
      "prefixItems": [
        {
          "const": "NO_PROOF_ASSISTANT_OR_GEOMETRIC_HOMEOMORPHISM_CLAIM"
        }
      ],
      "type": "array"
    },
    "result": {
      "additionalProperties": false,
      "properties": {
        "cycle_coordinate_matrix": {
          "items": {
            "items": {
              "type": "integer"
            },
            "maxItems": 10,
            "minItems": 10,
            "type": "array"
          },
          "maxItems": 10,
          "minItems": 10,
          "type": "array"
        },
        "determinant": {
          "type": "integer"
        },
        "facet_order": {
          "items": {
            "items": {
              "type": "integer"
            },
            "maxItems": 3,
            "minItems": 3,
            "type": "array"
          },
          "maxItems": 10,
          "minItems": 10,
          "type": "array"
        },
        "homology": {
          "const": "Z/2Z"
        },
        "non_tree_edges": {
          "items": {
            "items": {
              "type": "integer"
            },
            "maxItems": 2,
            "minItems": 2,
            "type": "array"
          },
          "maxItems": 10,
          "minItems": 10,
          "type": "array"
        },
        "spanning_tree": {
          "items": {
            "items": {
              "type": "integer"
            },
            "maxItems": 2,
            "minItems": 2,
            "type": "array"
          },
          "maxItems": 5,
          "minItems": 5,
          "type": "array"
        }
      },
      "required": [
        "spanning_tree",
        "non_tree_edges",
        "facet_order",
        "cycle_coordinate_matrix",
        "determinant",
        "homology"
      ],
      "type": "object"
    },
    "scope": {
      "const": "EXACT_DECLARED_SIMPLICIAL_COMPLEX:coordination-cycle-lattice-01",
      "type": "string"
    },
    "task_id": {
      "const": "jacobian/coordination-cycle-lattice-01"
    }
  },
  "required": [
    "task_id",
    "conclusion",
    "result",
    "claimed_assurance",
    "scope",
    "completeness",
    "evidence",
    "limitations"
  ],
  "type": "object"
}
