{"claimed_assurance":"COMPUTED","completeness":"COMPLETE","conclusion":"INTEGRAL_H1_CERTIFIED","evidence":[{"path":"evidence/certificate.json","sha256":"sha256:6512299ca0c77f7f05774de389749ee36f9d9192eedb90f5a252014fcf01274d"}],"limitations":["NO_PROOF_ASSISTANT_OR_GEOMETRIC_HOMEOMORPHISM_CLAIM"],"result":{"cycle_coordinate_matrix":[[1,0,0,0,0,1,0,0,0,0],[0,0,0,0,0,0,1,1,0,0],[0,0,0,0,0,-1,-1,0,0,0],[0,1,0,0,0,0,0,-1,0,0],[0,0,1,0,0,0,0,0,1,0],[0,0,0,0,0,1,0,0,0,1],[0,0,0,0,0,0,0,0,-1,-1],[0,0,0,1,0,0,1,0,0,0],[0,0,0,0,0,0,0,1,1,0],[0,0,0,0,1,0,0,0,0,1]],"determinant":-2,"facet_order":[[10,11,12],[10,11,15],[10,12,13],[10,13,14],[10,14,15],[11,12,14],[11,13,14],[11,13,15],[12,13,15],[12,14,15]],"homology":"Z/2Z","non_tree_edges":[[11,12],[11,13],[11,14],[11,15],[12,13],[12,14],[12,15],[13,14],[13,15],[14,15]],"spanning_tree":[[10,11],[10,12],[10,13],[10,14],[10,15]]},"scope":"EXACT_DECLARED_SIMPLICIAL_COMPLEX:coordination-cycle-lattice-01","task_id":"jacobian/coordination-cycle-lattice-01"}
